93973,Order1886,2015-02-20,10,Excelente juego es evidente que si tiene muy poca duración pero la diversión que me dio para esa cantidad de horas fue un deleite que hacen que merezca este 10 que le estoy dando!
93574,Order1886,2015-02-22,10,"This game is fantastic!!!Its  one of the first real time game\,all of the game subjects are amazing\,graphic \,story \,sound and musics are amazing\,RAD  working  on this game over 9 years\,and its not right to take this score\,people never understand!!!!i give 10 to this game… Expand"
93575,Order1886,2015-02-23,8,"This was a very enjoyable game. Great voice acting\, great graphics\, and great story.  My only problems with the game were limited controlling\, one camera to use at all times\, and crappy aiming/shooting.   I had a really fun time playing this\, just wish was a tad longer\, still a great experience overall."
93576,Order1886,2015-02-23,5,"This game is a waste of time\, money\, and effort. My friend and I played through it in tandem\, switching off at levels end\, and completed it in 6.5 hours. Total garbage this game is... if you must play it\, rent it."
93577,Order1886,2015-02-24,10,"This is a unique game. The game has an interesting story\, beautiful graphics and excellent gameplay. This is one of the best exclusives for the PlayStation 4."
93618,Order1886,2015-03-03,9,"Ein wirklich gutes Spiel\, mit einer toller Story. Die Kinoreife Inszenierung hat mir sehr gut gefallen. Negativ ist das die Spielzeit doch sehr kurz ist und auch auf schwer nicht wirklich eine Herausforderung ist.  Leider bekommt das Spiel nicht die Anerkennung die es verdient hätte."
94009,Order1886,2018-07-24,10,Best Looking PS4 game ever? It might just be. Play this game alone for the graphics. It is amazing looking and plays similar to Gear of War. There really is no reason for reviews to be so negative on this game other than the lack of other modes.If you want an amazing single player game for cheap pick this up now.
92980,Order1886,2015-02-25,9,"Took me ten hours to beat it on medium\, and I enjoyed every bit of it.  Not many games out there that are set in the late 1800s\, and the graphics are so good that it helped me get immersed in it.  The final scene in the game has me excited about a sequel.  Liked this game enough that I won't be trading it in\, I'm going to try for the platinum."
92996,Order1886,2015-04-26,8,"Really enjoyed this game\, definitely worth a play if you enjoy cinematic games\, only a few flaws\, the main one that it's a bit short\, but 8 think I put around 8 hours into getting the platinum for this game which is well worth it for the £20 price tag.Excellent story\, satisfying gameplay\, stunning graphics\, worth a try unless you're a die hard FPS fan."
93106,Order1886,2020-11-06,7,"Gostei do jogo\, tem uma boa história\, gráficos incríveis\, melhor do que muitos jogos atuais\, a gameplay é simples\, funciona bem\, o grande defeito do jogo é a duração\, na minha primeira jogada devo ter levado umas 6 horas para terminar\, em menos de 12 horas você platina\, então é bem curto."
93107,Order1886,2020-11-06,7,"Gostei do jogo\, tem uma boa história\, gráficos incríveis\, melhor do que muitos jogos atuais\, a gameplay é simples\, funciona bem\, o grande defeito do jogo é a duração\, na minha primeira jogada devo ter levado umas 6 horas para terminar\, em menos de 12 horas você platina\, então é bem curto."
93108,Order1886,2020-09-07,8,"Отличное кино про охотников на оборотней. Даже в 2020 пачка отвисает от графики\, да и музыка очень хороша. Дай бог \, чтобы продолжение увидело свет \, ибо профукать такую вселенную - грех . А так - короткая демка\, с заделом на будущее.Отличное кино про охотников на оборотней. Даже в 2020 пачка отвисает от графики\, да и музыка очень хороша. Дай бог \, чтобы продолжение увидело свет \, ибо профукать такую вселенную - грех . А так - короткая демка\, с заделом на будущее."
93109,Order1886,2020-09-07,8,"Отличное кино про охотников на оборотней. Даже в 2020 пачка отвисает от графики\, да и музыка очень хороша. Дай бог \, чтобы продолжение увидело свет \, ибо профукать такую вселенную - грех . А так - короткая демка\, с заделом на будущее.Отличное кино про охотников на оборотней. Даже в 2020 пачка отвисает от графики\, да и музыка очень хороша. Дай бог \, чтобы продолжение увидело свет \, ибо профукать такую вселенную - грех . А так - короткая демка\, с заделом на будущее."
93110,Order1886,2016-02-12,8,"I get why people is giving such crappy scores to this game. For me\, one of the main reasons is that this game has not managed expectations properly and the marketing campaign was wrong.I don’t know about you guys\, but before this game was released I read quite a bit about it in my videogames magazines and it was always sold as a 3rd person shooter. Well\, the thing is\, that for me isI get why people is giving such crappy scores to this game. For me\, one of the main reasons is that this game has not managed expectations properly and the marketing campaign was wrong.I don’t know about you guys\, but before this game was released I read quite a bit about it in my videogames magazines and it was always sold as a 3rd person shooter. Well\, the thing is\, that for me is not a pure 3rd person shooter (let’s say as Uncharted or Tomb raider)\, and it was advertised as one. So yes\, If you go and buy this game expecting the see the next uncharted or whatever you will be massively disappointed.So what is this game? I’d say is somewhere between Until dawn kind of games and Uncharted. It has a bit of Until Dawn in terms of the game being focused on a story rather than on game play. This means you’ll have quite a few cut-scenes\, some of them long and quite a bit of the action is in the form of QTEs. It is just a bit like Until dawn\, because it is obviously not so good at giving you choices of what to say or to do (actually it gives you none). On the other hand is a bit like uncharted\, meaning you have some really good shootouts (the mechanics are really good) but then there is no plataforming at all. So summarising\, that’s why I said is a bit between Uncharted and until dawn\, it is none of them but something in between. The order is a story driven game\, where you walk around a bit and you take control for the shooting. This means the game is not great as an adventure like game (e.g. until dawn) and not great as a shooter (e.g. Uncharted) but what’s good is very good.The setting is awesome and I am not talking about the graphics (and yes\, they are very enjoyable). I am talking about the atmosphere as a whole. It is kind of a bit realistic\, mixed with fantasy\, very dark\, simply a great universe. The story and the characters are good\, not awesome but quite good\, much better than in most thriller movies. The shooting mechanics are very well implemented; shooting feels good\, and very enjoyable and using the right kind of weapon makes a difference I think.So yes\, if you know what you’re against when you get this game\, I think you’ll find it very enjoyable. If you are expecting a very specific genre (3rd person shooter) you’ll be disappointed because it is just not that. It is not a masterpiece and it is quite average as a 3rd person shooter or an adventure game but it is quite good as a weird mixture of those two genres.… Expand"
93111,Order1886,2016-01-25,5,"This is probably the best looking video-game that I'm seen on the PlayStation 4 so far. Unfortunately as stunning as the graphics were\, the game-play is severely lacking. This plays more along the lines of a Telltale Games titles with it's scripted option\, and visual indicators for combat. The story was short\, and I feel that the developer could've done more here. Maybe we'll see a sequel\,This is probably the best looking video-game that I'm seen on the PlayStation 4 so far. Unfortunately as stunning as the graphics were\, the game-play is severely lacking. This plays more along the lines of a Telltale Games titles with it's scripted option\, and visual indicators for combat. The story was short\, and I feel that the developer could've done more here. Maybe we'll see a sequel\, or perhaps some DLC down the pike. Overall this game is worth getting if you can pay under $20 USD\, in my opinion. This was also a very easy Platinum trophy to get on PS4\, if you're a trophy hunter.… Expand"
93112,Order1886,2019-07-19,8,"Look\, I'm old. I have a family. I don't have much time for gaming. I certainly don't get or play new releases. The Order is regularly around $5 on sale. It it easily worth that. The story is well written and engrossing. The controls are responsive and effective. The graphics and sound are top notch. Overall this is probably one of the best Third Person Shooters I've ever played. I get whyLook\, I'm old. I have a family. I don't have much time for gaming. I certainly don't get or play new releases. The Order is regularly around $5 on sale. It it easily worth that. The story is well written and engrossing. The controls are responsive and effective. The graphics and sound are top notch. Overall this is probably one of the best Third Person Shooters I've ever played. I get why people were upset paying $60 for this \""short\"" side of a game\, but at the current price\, you're crazy not to give it a go. It really is a masterpiece of a game.… Expand"
93113,Order1886,2016-02-25,8,"Well I'll start by saying that critics either user or editorial should take into consideration that maybe the game may not appeal to the tastes of the one writing the review and that is exactly what happened to destroy the reputation of the game. It's simple common sense that if you go in and being pucky about all the little things that don't tickle your fancy the you give the game a badWell I'll start by saying that critics either user or editorial should take into consideration that maybe the game may not appeal to the tastes of the one writing the review and that is exactly what happened to destroy the reputation of the game. It's simple common sense that if you go in and being pucky about all the little things that don't tickle your fancy the you give the game a bad rep and then all the robots will follow in that reviewers footsteps.  To those who appreciated the game I salute you and I feel that is still hope yet. The game is short but anything longer would have just been filler and would have been bad for the game. The story is magnificient\, MATURE.  The grahics are ... well nothing less than breathtaking. That all put together created something that would for me a lasting appeal. Bottom line if you want a sandbox style game by all means go play one. I you want different experience that you will not get bored of in the first playthrough\, and will probably go for a next play just cause it was that good\, then by all means join the order. Always appreciate what is brought to the table and don't be too quick to judge and you might be pleasantly surprise.… Expand"
93114,Order1886,2016-03-20,8,"The game is underrated I guess. The story is great\, the characters\, atmosphere\, gameplay is great. It's a beautiful game.It's a bit short okay and sometimes the \""point and click\"" stuff come too often. But anyway I'm happy to have finished the game it was great :)I really they are planning to do the sequel :D"
93115,Order1886,2016-03-20,9,I was put off this game by some friends and reviews however when I found it available for five bucks I thought I would check it out. I am glad I did... Whilst the actual game mechanics are a little lacking it is not the worst FPS I have played and the graphics are truly amazing.  The best element for me though was the story... Yeah it can be a bit obvious but so what it is still well toldI was put off this game by some friends and reviews however when I found it available for five bucks I thought I would check it out. I am glad I did... Whilst the actual game mechanics are a little lacking it is not the worst FPS I have played and the graphics are truly amazing.  The best element for me though was the story... Yeah it can be a bit obvious but so what it is still well told and full of ups and downs.… Expand
93116,Order1886,2016-04-05,7,"Безумно красивая игра. И дело даже не в технической части - а в проработке мира\, во внимании к деталям\, в правильной режиссуре. Отличная атмосфера\, которая затягивает и не отпускает\, но при этом полностью посредственный геймплей\, которого очень мало\, глупейшие противники и море нераскрытого потенциала. Очень надеюсь\, что разработчики учтут все минусы и промахи и исправятся в следующейБезумно красивая игра. И дело даже не в технической части - а в проработке мира\, во внимании к деталям\, в правильной режиссуре. Отличная атмосфера\, которая затягивает и не отпускает\, но при этом полностью посредственный геймплей\, которого очень мало\, глупейшие противники и море нераскрытого потенциала. Очень надеюсь\, что разработчики учтут все минусы и промахи и исправятся в следующей части. Главное для нового ip - сделать интересный новый мир и сеттинг\, у них удалось.… Expand"
93117,Order1886,2016-04-14,5,"Es una de las experiencias graficas mas satisfactorias que hay. Eso hay que aplaudirlo. La historia se pudo haber explotado de una manera expectacular ya que el tema era interesante (lobos y vampiros) pero es en lo que menos enfoca el juego. Solo 4 peleas con lobos y ninguna con vampiros. El juego es mas pasillero que los Gears of Wars (por el tamaño de los pasillos\, diminutos) El juego teEs una de las experiencias graficas mas satisfactorias que hay. Eso hay que aplaudirlo. La historia se pudo haber explotado de una manera expectacular ya que el tema era interesante (lobos y vampiros) pero es en lo que menos enfoca el juego. Solo 4 peleas con lobos y ninguna con vampiros. El juego es mas pasillero que los Gears of Wars (por el tamaño de los pasillos\, diminutos) El juego te deja queriendo mas\, pero no por la duracion (que es casi nada\, en un dia te lo pasas sin complicarte mucho) sino porque el tema del juego era bueno. Lastima. Recomendable solo para los que le gusten los graficos sin jugabilidad.… Expand"
93118,Order1886,2016-04-12,6,"GOOD: Graphics are really great\, some action scenes are entertaining\, good mission structure.BAD: Game play feels really old\, black lines\,  not much action\, sometime are really boring\, too much cinematic\, zero replay ability."
93119,Order1886,2016-04-12,5,"I remember seeing previews of this game and thinking The Order 1886 was going to be a fantastic game\, but I was wrong.The positive\n\nThe graphics are really impressive\nHas good story\n\nThe bad\n\nThe gameplay or lack of gameplay.\n\nStory and graphics help a game\, but the most important thing for a game to be enjoyable is the gameplay.\nThis game is basically segments of cut-scenesI remember seeing previews of this game and thinking The Order 1886 was going to be a fantastic game\, but I was wrong.The positiveThe graphics are really impressiveHas good storyThe badThe gameplay or lack of gameplay.Story and graphics help a game\, but the most important thing for a game to be enjoyable is the gameplay.This game is basically segments of cut-scenes with small portions of gameplay.I got so annoyed that I wish I had the option to skip the small sections of gameplay and watch it like a movie.… Expand"
93120,Order1886,2020-01-18,9,"Looked great. Was enjoyable. Unfortunately was a bit shorter than it should have been. Though it may not have had groundbreaking gameplay mechanisms\, one should never forget that gaming is about having a good time playing and The Order definitely delivered a good time."
93121,Order1886,2015-02-21,1,"Good graphic........................checkGood style.............................checkGood game............................error...............ERROR. SYSTEM FAILERROR. GAME NOT FOUND\, TRY AGAIN.Even first walktrough not interesting. No dynamic\, no BOSS\, no interesting story. bothing."
93122,Order1886,2015-02-21,8,"This is really good game. Is it movie? yes. Is it game? yes? Is it worth a buy? Yes on a disk and then you can sell it. It's really new experience\, music\, dialogs\, atmosphere - amazing. GRAPHICS ARE REALLY CINEMATIC\, no words\, just try it. It's definitely 8/10Why?Too shot.Some gameplay moments are not so good as you want it to be.If u have ps4 it definitely WORTH A BUY."
93123,Order1886,2016-04-12,5,"El juego en si es un gran avance a nivel tecnico\, la movilidad deja mucho que desear y en especial por los quick time events\, aclaro que a mi punto de vista no es un juego malo\, por lo contrario es un juego que sobresale por sus graficos y por meter un nuevo genero a la industria de los videojuegos\, la forma de crear un medio casi cinematografico\, pero la parte negativa es que no deja unEl juego en si es un gran avance a nivel tecnico\, la movilidad deja mucho que desear y en especial por los quick time events\, aclaro que a mi punto de vista no es un juego malo\, por lo contrario es un juego que sobresale por sus graficos y por meter un nuevo genero a la industria de los videojuegos\, la forma de crear un medio casi cinematografico\, pero la parte negativa es que no deja un personaje memorable o una rejugabilidad deseada\, aunque lo acabes en dificultad mas elevada solo ofrece a lo mucho de 7 a 8 horas de juego\, despues de eso de haberlo terminado\, no me he visto la necesidad de volver a jugarlo. a mi punto de vista un juego que pueden darle la oportunidad estando a un buen precio. vale la pena probarlo pero no esperen a que sea un juego de completa satisfaccion.… Expand"
93124,Order1886,2016-04-25,5,"Buenas\, un juego que luce bastante bien\, a pesar de esas bandas negras.El juego es super corto y con alquilartelo un fin de semana te vale para pasartelo\, no te van a quedar ganas de rejugarlo.Nada que ver con la expectación que se creó.Le doy un 5.Un saludo."
93125,Order1886,2016-05-19,6,"The Order or\, more appropriately\, The Rental: 1886\, is a short but decent game. The graphics are impressive and the combat was actually semi-exciting\, but nothing special. It *is* a step above generic\, but it's nowhere near a great game.The story felt like there wasn't much effort put into it by the writers and the ending was anticlimactic. I think the writers were shooting for aThe Order or\, more appropriately\, The Rental: 1886\, is a short but decent game. The graphics are impressive and the combat was actually semi-exciting\, but nothing special. It *is* a step above generic\, but it's nowhere near a great game.The story felt like there wasn't much effort put into it by the writers and the ending was anticlimactic. I think the writers were shooting for a cliffhanger but\, unfortunately\, they failed in that aspect. And usually I don't mind linearity if it's in a well-executed game (like Metal Gear Solid)\, but in The Order\, it just doesn't work out.While it's a graphically beautiful game and the combat mechanics are decent\, The Order left me wanting more\, and there's practically no replay value to it at all. I'd say it's a game worth playing through once\, but it's not worth the hefty price tag it still fetches at Gamestop.… Expand"
93126,Order1886,2016-08-16,5,"The Order: 1886 is a mediocre game\, at best. While visually impressive\, the story is lackluster and the gameplay is bland.With a 6 hour long campaign\, and absolutely no incentive to replay it\, The Order: 1886 is a third person shooter that adds nothing new to the formula. It's full of quicktime events\, generic weapons (a very few have an interesting \""alt\"" mode)\, extremely painfulThe Order: 1886 is a mediocre game\, at best. While visually impressive\, the story is lackluster and the gameplay is bland.With a 6 hour long campaign\, and absolutely no incentive to replay it\, The Order: 1886 is a third person shooter that adds nothing new to the formula. It's full of quicktime events\, generic weapons (a very few have an interesting \""alt\"" mode)\, extremely painful stealth sections (with a horrible sneaking and cover mechanics) and a good few collectibles that add little to the experience.The story is bland and full of cliche twists and turns and ends on a rather unsatisfactory way\, making you wonder if this was supposed to be a prologue of some sort\, and introductory chapter to a bigger\, better story.Visuals are the high point of the game\, with nicely detailed and dark toned environments of an alternative Victorian England. Another redeeming quality is the good performance from its voice actors\, who had a very good delivery\, despite the bland and uninspiring script.Overall\, this is a mediocre experience. If you're still curious\, I recommend you get this game cheap or try to get a friend to lend it to you.… Expand"
93127,Order1886,2020-11-05,7,"A fairly satisfying experience overall. Still looks top class 5 years later\, its slowness being the obvious compromise. Combat feels like sub-par Uncharted\, it needed to be less stiff and use the \""science weapons\"" more. The story is entertaining and introduces us to in interesting world. I was happy it wasn't long and drawn out."
93128,Order1886,2016-08-24,5,Biggest disappointment of 2015. Probably some of the best graphics i have ever seen and the story had so much promise. A fun but woefully brief shooter which is way below its value for money. Buy if you want an interactive movie.
93129,Order1886,2016-11-18,6,"The Order 1886\, talvez seja a maior decepçao de 2015\, um dos filmes com mais eu fiquei com expectativas\, pela historia\, eu espera um game épico\, mais é apenas um jogo mediano\, com raros bons momentos\, mais vamos começar pelos pontos positivos\, o grafico é fantastico\, talvez o melhor da nova geraçao\, algo espetacular\, a historia é muito boa\, infelizmente foi mal aproveitada\, o jogo temThe Order 1886\, talvez seja a maior decepçao de 2015\, um dos filmes com mais eu fiquei com expectativas\, pela historia\, eu espera um game épico\, mais é apenas um jogo mediano\, com raros bons momentos\, mais vamos começar pelos pontos positivos\, o grafico é fantastico\, talvez o melhor da nova geraçao\, algo espetacular\, a historia é muito boa\, infelizmente foi mal aproveitada\, o jogo tem capitulos ridiculo\, pelo simples fato que teve uns capitulo é apenas um dialogo e acabou\, sem nenhum cena de açao\, a trilha sonora é boa\, os personagens sao bons\, pelo menos eu gostei deles\, a direçao de arte do jogo é muito boa\, tem momentos bons o jogo\, mais infelizmente é um decepçao\, um jogo que tem mais cutscenes do que açao\, mais eu queria ver uma continuaçao\, porque eu acredito que a desenvolvedora aprenderia com erros e faria um jogo melhor. Nota 6.5… Expand"
93130,Order1886,2016-11-07,5,"This game is basically based on the Tomb Raider model from 1996 with less climbing and more shooting  but it fails in any way to live up to that game.  The graphics are shiny but the PS4 is a beast\, the story is decent but it's soooo linear and you don't feel like you're free at any point as you can only draw your weapons at specific times and can only run at specific times\, climbing andThis game is basically based on the Tomb Raider model from 1996 with less climbing and more shooting  but it fails in any way to live up to that game.  The graphics are shiny but the PS4 is a beast\, the story is decent but it's soooo linear and you don't feel like you're free at any point as you can only draw your weapons at specific times and can only run at specific times\, climbing and jumping is always sending exactly where you need to go\, it's just so claustrophobic.… Expand"
93131,Order1886,2019-11-07,9,"Эта игра одна из самых замечательный и интересныхДанная игра в жанре интерактивного кино и финал данной игры вам понравится\, советую чтобы поиграть)"
93132,Order1886,2020-09-22,3,Piece of crap of a game. It's more boring that listening a chess match through radio. Do not buy it
