93884,Order1886,2015-03-06,8,"The game is fairly good\, contrary to popular belief. Once you get over how beautiful it is (which is going to take a really long time) you have really enjoyable combat that feels varied throughout thanks to fun weapons. I also enjoyed the story even though it left plenty of unanswered questions as it's quite clearly meant to get a sequel. To conclude\, it's a fun game\, more positive thanThe game is fairly good\, contrary to popular belief. Once you get over how beautiful it is (which is going to take a really long time) you have really enjoyable combat that feels varied throughout thanks to fun weapons. I also enjoyed the story even though it left plenty of unanswered questions as it's quite clearly meant to get a sequel. To conclude\, it's a fun game\, more positive than there is negatives and the feared QTE's are actually well implemented. 8/10… Expand"
93885,Order1886,2015-02-22,5,"The Order: 1886 is the net result of AAA developers focusing on something that grabs people on the surface of what it looks like it's going to be\, but doesn't focus at all on adding meat to the bones of the title. It is visually stunning\, has fantastic audio and on the surface looks an absolute masterpiece.Unfortunately\, you then play the game for more than 30 minutes\, and you realiseThe Order: 1886 is the net result of AAA developers focusing on something that grabs people on the surface of what it looks like it's going to be\, but doesn't focus at all on adding meat to the bones of the title. It is visually stunning\, has fantastic audio and on the surface looks an absolute masterpiece.Unfortunately\, you then play the game for more than 30 minutes\, and you realise that you may as well be watching a mediocre CGI movie rather than play through a drab\, unevenly paced 3rd person bog-standard cover shooter with a badly wasted setting due to a lacklustre plot.To use a book analogy\, you pick the book up\, you look at the amazing cover and can't wait to read the whole thing. You then read the first chapter and you're thinking\, \""wow\, this could be the best book ever!\"". Then you read chapter two\, and it's the same thing as chapter one\, but toned down. Chapter three is the same. By this point\, you're asking yourself\, \""so yeah\, the first part was great\, but can I have something else now?\"" But chapter four and five are the same. At this point\, you're bored of the story. The characters are boring\, and the pretty cover art is a distant memory. By chapter six\, you've lost all interest\, and then it ends at chapter seven\, because the story is short anyway. The impression you're left with is that everything around the story was great\, but the story itself was abysmal.And thus\, The Order: 1886 joins the growing list of AAA titles on the \""next gen\"" systems that flatters to deceive. My guess is that only about half of those who play the game will have the willpower to finish it\, and only half again will actually enjoy it\, and those that do are those who value something that looks good rather than actually IS good.… Expand"
93886,Order1886,2015-03-10,8,"the only bad thing in this game was small content everything else amazing\,the best graphics i have ever seen\,solid story\,amazing weapons\,it will be a great franchise for sony"
93887,Order1886,2015-03-10,9,"The Order: 1886 is a masterpiece. The cinematic aspects of the game are done so perfectly\, that I enjoyed watching lengthy cut scenes about characters I genuinely cared about. The voice acting is some of the best out there\, and the characters are interesting enough to invest you into the story\, which is told so well. The graphics are if not the best graphics I've seen in a game ever\, andThe Order: 1886 is a masterpiece. The cinematic aspects of the game are done so perfectly\, that I enjoyed watching lengthy cut scenes about characters I genuinely cared about. The voice acting is some of the best out there\, and the characters are interesting enough to invest you into the story\, which is told so well. The graphics are if not the best graphics I've seen in a game ever\, and it really helps show off what the PS4 can output.Now there are of course some flaws to the game\, such as the length and replayability (took me about 7 hours to finish story and there is no multiplayer or co-op)\, the shooting may be a bit outdated (reminded me of the first Uncharted)\, but this game is a very well done introduction game to what could be a fantastic series.All in all\, The Order: 1886 is a great game for players that enjoy great storytelling\, admiral-able characters\, and spectacular graphics with no bugs or glitches. Although short in length\, it provides you with an amazing experience as you travel around steam punk London.Well done Ready at Dawn.… Expand"
93888,Order1886,2015-09-25,10,"The Order is a magnificent game. It has a very interesting story\, nice plot\, excellent acting\, solid shooting mechanics\, amazing soundtrack and unbelievable graphics.It is really sad that the devs do not get the credit this game really deserves. It is an interactive movie for sure\, it includes many cutscenes\, lots of QTE's and yes\, walking. But all of the above aim at putting youThe Order is a magnificent game. It has a very interesting story\, nice plot\, excellent acting\, solid shooting mechanics\, amazing soundtrack and unbelievable graphics.It is really sad that the devs do not get the credit this game really deserves. It is an interactive movie for sure\, it includes many cutscenes\, lots of QTE's and yes\, walking. But all of the above aim at putting you inside Galahad's (the main protagonist) shoes. I really enjoyed the walking scenes\, admiring the great atmosphere of the setting\, and taking in all these simply magnificent graphics. You really must experience this if you own a PS4. Ignore all the bad rants about this game\, this is not call of duty\, or Gears of War\, and it sure is not Heavy Rain\, it has its own character. Actual shooting scenes are nice\, I played it on hard difficulty and it gave me a good challenge. It took me more than 10 hours to complete\, including my failures ofcourse\, but I didn't find it short or lacking. It is simply stupid to judge a game by its length\, especially when it is a linear story based game like this. Ofcourse there are negative aspects\, like the boring lycan fights\, but again\, these didn't spoil the atmosphere or break the game for me.I really hope Ready at Dawn produce a sequel for this\, and I really hope they keep the walking intact ! I like the game to be atmospheric\, i love wandering and just drooling all over these beautiful graphics and taking in all the atmosphere\, I really hope we will get the chance to experience it again.… Expand"
93889,Order1886,2015-02-22,10,"From the moment I booted  up  The  Order 1886 to  the second the credits rolled I was absolutely emerged in the world and the story that was created. I found the technological  spin on Victorian London in 1886 to be thet most interesting setting I've ever gotten the priveledge to  explore in a video game. And without a doubt\, it has the best graphics ever seen in a video game\, it'sFrom the moment I booted  up  The  Order 1886 to  the second the credits rolled I was absolutely emerged in the world and the story that was created. I found the technological  spin on Victorian London in 1886 to be thet most interesting setting I've ever gotten the priveledge to  explore in a video game. And without a doubt\, it has the best graphics ever seen in a video game\, it's obvious. The game looks like your playing a Blu Ray movie.Thankfully the story was just as good as the setting\, and it had very memorable characters. I especially liked  the main character and the 2 most prominent female characters. The acting is spot on and you just keep wanting more.Obviously the gameplay is some peoples primary concern\, and I had concerns as well but let me tell you what I was most blown away by IMO......The third person cover shooter  gunplay in this game is unlike  anything  I've ever played. It's completely  original IMO. You can't stay out of cover and  simply pick off your  enemy when he  pops out of  cover\, if you leave cover for more than  2-3 seconds on Hard\, your dead. Snipers are placed across the map that kill you in 2 shots. In order  to succeed  they give  you some pretty cool tactics.  Like the option to hold only your arm out of cover to just spray and  prey wildly\, I've never seen it emplimented this good to where it's not cheating. This causes  your enemys to either get behind cover\, or you may kill them if you  spray enough. The game places heavy damage snipers in certain spots\, and enemies with pistols and machine guns have thier positions. You  also can't just stay in one spot\, because the hard to kill shotgun enemys will charge you\, and if he hits you twice\, your dead(I play  on  hard).  Another thing different about the gunplay is the way  the guns feel and the strategy you have to use to be accurate with the weapons. The weapons  in this game are truly awesome\, they  are perfect. They feel like real guns\, they kick like real guns\, they are inaccurate like  real guns sometimes. With some guns you have to time your shot just right or you will just skim the enemy. The game also  has some truly unique weapons  that you've never seen before. And each of the 10-15 different weapons  has it's own purpose.Another part of the game I  was blown away by was  the different ways you can interact with the world. In some games\, if you  go up to a note on a piece  of paper\, the paper magically super imposes itself on your screen\, and you read it\, and then it goes away. In  The Order\, you pick up the note with your hand\, move it in  any direction\,  then when your done\, you place it back down. You do this with most physical items you can pick up in the game. And instead of just giving you a lock picking game like all other games\, you have a tool designed by Tesla to pick locks that feels like you are actually picking the lock\, not just playing a mini game. There are SO many items like this that you actuallly physically use in the game\, like the device you use to open the armorys designed by Tesla\, and  your monocular is also one of the coolest things. Everything in this game feels REAL\, I can't emphasize that enough. NO mini games\, NO menus\, NOTHING that would remind you that you are in a video game. And the fact that it's bug free and smooth as butter is truly amazing at a time when games ship broken.My favorite parts of the game was the stealth  section at night in this beautiful  garden in the middle of London while it's raining. All the  guards are walking around with  lights  and you can either shoot them with your very  limited amount of arrows\, or if you time it right\, you can melee your enemy for  a truly awesome and brutal looking take down. Another favorite part of my playthrough was walking underground beneath london\, they give you these lanterns and it's pretty damn  creepy   and the environment just sucks you in completely. I felt I was inside the game during these sections and it looked so awesome.If you want a game like Destiny\, COD\, or some other grinding twitchy  game. That's fine\, I sometimes like those games too. But every game doesn't need to be THAT. And if you want the usually survival exploration third person shooter like Tomb Raider\, The Last of Us\, or Uncharted\, those games are awesome. This game is different. You don't \""Level Up\""\, it's not \""Open World\"". It's The Order 1886.The Order  1886 is  an expertly polished\, truly immersive\, ground breaking experience that's never been done  before. It has original class leading graphics\,fresh game play\, and a way  of telling you the story never before exerienced in a video game. If you want an  experience you truly have never had before\,  I recommend you try The Order 1886.I rate games based on the answer to this question. Did the developer create the exact game they wanted to create\, without cutting any corners\, and perfectly realizing thier idea? Yes\, 100%.The Order 1886- 10/10… Expand"
93890,Order1886,2015-02-28,10,"Personally\, I loved every minute of it. It doesn't just set a new benchmark for graphics but also for voice acting and cinematic story. And what a story! Could easily be made into a movie just as it is. As for length\, I set it on hard and it's taken a good 12 hours + to complete because you're forced to actually play it as a cover shooter as health is very limited and the AI will happilyPersonally\, I loved every minute of it. It doesn't just set a new benchmark for graphics but also for voice acting and cinematic story. And what a story! Could easily be made into a movie just as it is. As for length\, I set it on hard and it's taken a good 12 hours + to complete because you're forced to actually play it as a cover shooter as health is very limited and the AI will happily flank you. The pacing is the only thing I could criticise and Ready At Dawn could use a few pointers from Naughty Dog here for the sequels\, but the press seem to need something to stab with their sharpened knives this month and\, unfortunately\, this was the recipient. Is it as bad as they say? Absolutely not!… Expand"
93891,Order1886,2015-03-23,10,I am the guy which likes games with a story and not running frantically in an open world just to collect more and more stuff. I am also a guy who does not have the time to every day play games so it is nice if I can easily pick up a game without having to figure out what important thing I missed a week ago. So I really enjoyed playing the simple narrative storyline of 1886. And asI am the guy which likes games with a story and not running frantically in an open world just to collect more and more stuff. I am also a guy who does not have the time to every day play games so it is nice if I can easily pick up a game without having to figure out what important thing I missed a week ago. So I really enjoyed playing the simple narrative storyline of 1886. And as mentioned by others this game sets a new standard regarding the environment and visuals.… Expand
93892,Order1886,2015-02-25,10,"I stopped reading critics reviews a while ago. And luckily for that cause i might have missed out on this gem based on their review score.This game has it all:\nAn interesting story\nBelievable characters\nAmazing atmosphere\nIntense action/gunfights\nAnd the best graphics\, litterly the best graphics I've seen.\n\nThis game has balance\, you get into heavy gun fights then off to aI stopped reading critics reviews a while ago. And luckily for that cause i might have missed out on this gem based on their review score.This game has it all:An interesting storyBelievable charactersAmazing atmosphereIntense action/gunfightsAnd the best graphics\, litterly the best graphics I've seen.This game has balance\, you get into heavy gun fights then off to a consuming story part then off to cinematics and then back into the action. Everything is very well balanced.The content is mature\, and am i happy for that\, as i grow older i get more and more tired of cartoonish protagonist and stereotype villians\, you won't find any of that here.Try this game at your friends house then run out and buy it cause you will definitely miss out on a grand game if you pass on this one.I really cannot understand all the hate this game has gotten. Two thumbs up for delivering such a great experience..… Expand"
93893,Order1886,2015-02-21,5,"As others have said the game is beautiful to look at and what little game play there is is fluid. Unfortunately there is no real substance\, it's a very short game and the vast majority of it is taken up by overly long cut scenes\, it's more film than game. Which is a real shame and such a wasted opportunity\, it could have been a great game\, but the linear game play\, lack of ability toAs others have said the game is beautiful to look at and what little game play there is is fluid. Unfortunately there is no real substance\, it's a very short game and the vast majority of it is taken up by overly long cut scenes\, it's more film than game. Which is a real shame and such a wasted opportunity\, it could have been a great game\, but the linear game play\, lack of ability to explore and the really long cut scenes\, which were also way too numerous\, some chapters literally seemed to only be cut scenes made it a very boring game to play. Going to be trading my copy in for something better as soon as I can as I finished it in a few short hours and it has zero replay value.… Expand"
93894,Order1886,2015-02-22,9,"Don't believe the negative reviews (some from people who haven't even played the game). There is a lot of action and the cut scenes are not too long. If you are a fan of games like Bioshock and The Last of Us\, you will like this game. If you like a challenge\, change difficulty to hard and turn off auto-aim. The story is good\, the environments are amazing\, the attention to detail isDon't believe the negative reviews (some from people who haven't even played the game). There is a lot of action and the cut scenes are not too long. If you are a fan of games like Bioshock and The Last of Us\, you will like this game. If you like a challenge\, change difficulty to hard and turn off auto-aim. The story is good\, the environments are amazing\, the attention to detail is unbelievable. The best looking game yet.… Expand"
93895,Order1886,2015-02-23,9,The hate this game is getting.....is just stupid and retarded. I really really like this game and i wish they make a sequel with Multiplayer included.
93896,Order1886,2015-03-01,8,"After just finishing this game I finally came up with the best way to describe it: The Order 1886 is SO CLOSE to being a fantastic gaming achievement.Its very ambitious and different\, which I always love in a game\, god forbid the gaming world tries to adapt to something different. The art direction is fantastic\, the weapons are very unique and all feel like they have punch to them andAfter just finishing this game I finally came up with the best way to describe it: The Order 1886 is SO CLOSE to being a fantastic gaming achievement.Its very ambitious and different\, which I always love in a game\, god forbid the gaming world tries to adapt to something different. The art direction is fantastic\, the weapons are very unique and all feel like they have punch to them and all the characters are interesting. The story presented is very good\, while not edge-of-my-seat intense it never bored me and was interesting the whole time. There is lots of downtime and cinematic fights\, but they are all done extremely well. Do not let this be reason why you don't buy the game\, all the downtime is justified and relevant.I just can't put my finger on it\, but The Order is missing something.. I don't know what it is\, but while I was playing I just couldn't help thinking that this game needed one extra step to be a fantastic game. Maybe it was more dynamic shooting sections\, or less obtrusive way of including QTE'S? What is presented here is not bad by any means\, but The Order just needed one more spark to catapult it into greatness\, I truly believe that.Overall\, I do recommend you buy it if you want something different. If you hate when the gaming world does something different and would rather see another generic shooter\, then stay far away.… Expand"
93897,Order1886,2015-03-02,8,"I've read many reviews criticising \""The Order\"" for what it isn't.Indeed\, this game isn't Gears of War. It's not a 3rd person shooter\, also it's not a cinematic experience where you shape the outcome of things as in Heavy Rain. This game is a new breed of interactive CINEMATIC experience\, and I stress the word \""Cinematic\"" because that's what it is; the camera angles\, the linearity of theI've read many reviews criticising \""The Order\"" for what it isn't.Indeed\, this game isn't Gears of War. It's not a 3rd person shooter\, also it's not a cinematic experience where you shape the outcome of things as in Heavy Rain. This game is a new breed of interactive CINEMATIC experience\, and I stress the word \""Cinematic\"" because that's what it is; the camera angles\, the linearity of the stages\, the photography\, the progression of the story\, all of them serve for you to experience the director's vision. This is probably why so many people are rating this game with 50\, 40\, or below. I've seen reviews punishing it for things that are completely ignored in other games. For example:\"" The final boss is an anti climatic QTE fight that ends without answering many questions \""I may not be a professional critic but I did played Shadow of Mordor (finished it and got the platinum). And beating Sauron by pressing triangle (on Ps4) was the epitome of anti climatic. ¿How about beating the Black Captain with stealth drain? Yeah\, that was epic...The game is considerably easy to beat\, the only real challenge here are the shotgun specialists. It is quite short\, I got my platinum in 7-8 hours\, yet it kept me entertained for the duration.The order is a new experience that takes inspiration from many genres without being defined as one or another. ¿Is it perfect? No\, it isn't. ¿Is it crap? No\, it isn't. It's something different\, and\, for those of us that want more options in gaming rather than the yearly release of a \""new\"" Call of Duty (talk about the \""same old boring weapons\"") or the 11nth spin off on the space shooter: We should show more support to developers that TRY to create something different. This game is not for gamers who want the endless \""aim and shoot\"" or having a gun fight every 5 minutes and killing thousands of baddie's.If you are one of those players (not that there is something good or bad about it) that hate the new trend of cinematic games\, then avoid this one. If you are a fan of movies and want a varied experience\, then I recommend that you buy or rent this tittle.… Expand"
94010,Order1886,2018-08-24,10,"I am astonished but how badly this game was covered. It is a really good game and better than most.It's very high quality\, with incredible visuals and story\, almost up to par with something like God of War (2018).  Yes\, it is shorter than something like GOW and the gameplay is not on par but it is still pretty decent. This title surely deserves more than a 6 or 7 out of 10. It surelyI am astonished but how badly this game was covered. It is a really good game and better than most.It's very high quality\, with incredible visuals and story\, almost up to par with something like God of War (2018).  Yes\, it is shorter than something like GOW and the gameplay is not on par but it is still pretty decent. This title surely deserves more than a 6 or 7 out of 10. It surely is a 8/10 and beats many other games which received way more positive coverage.… Expand"
93898,Order1886,2015-03-03,8,"My \""The Order 1886\"" review:- Most beautiful game ever\n- Great tech; no visible loading screens & I encountered no bugs\n- Great game world; I would love to see more of it\n- Gameplay okay; I didn't like the first few hours and was annoyed by many missed opportunities and some strange design decisions. But at the end I enjoyed it\n- Nice story\, nice characters\, good acting\n-My \""The Order 1886\"" review:- Most beautiful game ever- Great tech; no visible loading screens & I encountered no bugs- Great game world; I would love to see more of it- Gameplay okay; I didn't like the first few hours and was annoyed by many missed opportunities and some strange design decisions. But at the end I enjoyed it- Nice story\, nice characters\, good acting- Appropriate length; I played ~9 hours and it felt adequate for the story- Price is an issue. I can understand if people don’t feel it’s worth 60+ bugs.In the end: Far better than some reviews suggested\, no reason for a **** storm.… Expand"
93899,Order1886,2015-03-04,8,Its a great game. the graphics are incredible. The story becomes magnificent and the cut scene become sporadic. I think its the new genere for the new Consoles. Good game.
