93678,Order1886,2015-03-22,9,"I just finished this game in one sitting\, and to be truly honest\, I'm dumbfounded at how this title could have gotten such low scores.  The graphics are the best in any video game to date and it's extremely polished with regards to story\, animations\, and voice acting.  Sure\, it has a few shortcomings... The environment isn't interactive.  You aren't leveling up your main character.  You'llI just finished this game in one sitting\, and to be truly honest\, I'm dumbfounded at how this title could have gotten such low scores.  The graphics are the best in any video game to date and it's extremely polished with regards to story\, animations\, and voice acting.  Sure\, it has a few shortcomings... The environment isn't interactive.  You aren't leveling up your main character.  You'll end up using whatever guns are scattered on the ground\, and you'll be doing just as much watching as you will actually playing the game.  But overall\, this was a captivating experience\, and one that should not be missed by anyone that owns a PS4.  Get over the fact that it's not going to be a run-of-the-mill action game and appreciate it for what it is; a visual masterpiece with some fun (although slightly clunky)  game-play\, an engaging story\, and a new benchmark for any cinematic-focused gaming experience.  Well done!… Expand"
93679,Order1886,2015-08-09,10,I wasn't expecting much from that game by reading all around reviews and scores. I found a good price in Blackwater edition and decided to give it a try and man i loved it. You also should give it a try i assure you wont regret too. The graphics are wonderful and have a great story too. The only point where it could be better is the short gameplay time.
93680,Order1886,2015-08-31,10,"I don't understand why people hate this game so much it is an average action packed game with an engaging story\, amazing graphics and smooth controls. I mean what is it not to like\, If you ever get a chance to buy the game at a discounted price for god sakes buy it."
93681,Order1886,2017-04-29,10,"Actual Rating - 8. Gave it a 10 because **** haters.Great game. I paid $40 for this and I was very happy with what I got. Even though it was initially released at $60\, which may have been too much to ask\, doesn't constitute people calling this a **** game. What makes a **** game? **** story\, characters\, derivative setting\, etc. None of that true for this game. Almost everything this gameActual Rating - 8. Gave it a 10 because **** haters.Great game. I paid $40 for this and I was very happy with what I got. Even though it was initially released at $60\, which may have been too much to ask\, doesn't constitute people calling this a **** game. What makes a **** game? **** story\, characters\, derivative setting\, etc. None of that true for this game. Almost everything this game did was good. My main issues were questionable AI and absolutely terrible werewolf sections\, and I didn't even get to fight a vampire in this game. Mind you the Elder boss fights were excellent\, loved those.I can tell with certainty that the sequel would have been excellent if only Sony had greenlit that. But sadly the plug was pulled. While I'm thoroughly satisfied with The Order 1886\, it will probably go down the best game I won't get to play a sequel of. Worse games have received them\, i.e. - Watch Dogs.… Expand"
93682,Order1886,2015-02-24,8,"How has this rated lower than games like Infamous Second Son and Watch Dogs not only by critics but (more importantly) users is absolutely beyond me.The game is not perfect true\, Yes it is short in length\, yes there are alot of cut scenes and no its not the most original of games in terms of game play but .....\n\n1.The graphics are the best I have ever seen on any given consoleHow has this rated lower than games like Infamous Second Son and Watch Dogs not only by critics but (more importantly) users is absolutely beyond me.The game is not perfect true\, Yes it is short in length\, yes there are alot of cut scenes and no its not the most original of games in terms of game play but .....1.The graphics are the best I have ever seen on any given console (seriously).2. The voice acting is unfaultable3. The story and the acting is (unlike what most are saying) actually pretty damn interesting and you will want to see it through until the end.4. London looks amazing and it really does have the feel of a late 19th centry city with a futuristic feel.5. The game has a balance of how much story and action it throws at you which for me at least\, was very refreshing.Now number 5 is probably what's got this game the low scores\, too many people wanting to jump straight in and shoot anything that moves  from start to end and that fine\, but people should respect this game for pacing it different to the typical shooter and focusing equally on story.Is the game perfect? No\,  but everyone (just as in Destiny) was expecting something mind blowing and this game delivered that in graphics alone but it should not be punished for its high expectation in every aspect that the public had\, that does not make it a bad game!This is a beautiful  game which if you have the attention span which is longer than that of a gun-ho \""kill everything every second\"" pre teen should invest in\, especially if you value a decent story.8/ 10 and certainly a heck of alot better than what many of the new gen mediocre games so far have brought us.… Expand"
93683,Order1886,2015-03-29,6,I can't give this game any higher than a 6 out of 10 because it has such a short length. This game is pretty fun but It's only like 5 hours long which is unacceptable because the games costs £55. It's a fun time but is not worth the money.6/10
93684,Order1886,2017-03-28,6,I will start off by saying unfortunately a lot of what you may have read is in fact accurate.While The Order: 1886 is a graphical masterpiece it has far more in common with titles released by TellTale Games than it does third person shooters like Gears of War. In it's brisk 5-7 hour run time (largely depending on player skill and the want/need to find the collectibles).
93685,Order1886,2015-04-04,6,"On the surface\, The Order 1886 is a remarkable feat. Sadly\, once your eyes adjust to its console defining graphics\, that feeling of greatness slowly fades and this PS4 exclusive becomes an incredibly conflicted game.  Over the years we’ve seen games become more focused on cinematic experiences and telling captivating stories\, most games use a mix of gameplay and cutscenes to take theOn the surface\, The Order 1886 is a remarkable feat. Sadly\, once your eyes adjust to its console defining graphics\, that feeling of greatness slowly fades and this PS4 exclusive becomes an incredibly conflicted game.  Over the years we’ve seen games become more focused on cinematic experiences and telling captivating stories\, most games use a mix of gameplay and cutscenes to take the player on a journey.  The Order 1886 is the perfect example of taking this idea too far.There is no denying the physical beauty of The Order 1886.  The player finds his or herself in a magnificent looking London during the year of\, you guessed it\, 1886.  Every physical detail is present\, from the cloth movement to how a bottle rolls over the cobblestone streets.  This just proves how beautiful a game can look.  Sadly the attention to the world’s aesthetics may be the cause of the game’s greatest downfall.Just like The Order itself\, the story is far better on the surface.  The player takes the role of Sir Gallahad\, a member of The Order\, a modern facet of King Arthur’s Knights of the Round Table. Their goal is to maintain peace within an alternate historical version of 1886 London.  The Order’s main enemies include a small band of Rebels and Werewolves\, or Lycans.  From here the story kicks off and slowly unravels till you reach an ending that will make shrug and say: “I guess it’s over?” When you're playing The Order\, shrugging will probably be something you do incredibly often.From the get go 1886’s main problem is revealed.  Pacing is certainly the enemy to any story and it is obvious from the start.  Most of the game’s chapters are filled with sections that the require you to walk\, incredibly slowly\, through a room\, hallway or dark corridor.  The game’s total playtime is no more than seven hours long\, but that really isn’t the issue.  The problem is how conflicted the game is at its core.  While trying to tell it’s less than satisfying story the player watches cutscenes\, slowly walks around\, and occasionally shoots enemies.The Order 1886 plays like the game equivalent to a pop-up book that only occasionally has little tabs you can actually use. As you meander through the game’s sixteen chapters\, some of which are only cutscenes\, there’s something that becomes progressively apparent. This isn’t an experience you become part of\, no this is a story that you’ll be force fed.  The story contains no sense of exploration\, danger or even depth.  This style of storytelling only subtracts from The Order’s positive notes\, like Sir Gallahad\, the outstanding lead character\, the remarkable over all world of 1886 and the interesting war between Knights and Werewolves.The Order’s combat is one of its greatest aspects; it plays like a traditional third person shooter\, yet doesn’t add anything new to the genre.  Each encounter is still enjoyable and a welcome break from the walking and waiting.  The vast array of weapons is another strong aspect of The Order 1886. Each gun is unique and fun\, but you really only get to use each weapon once or twice because of how little combat situations appear.Despite all of The Order’s substantial issues there is some definite promise for the future of this franchise.  1886 may not be the greatest third person shooter or even tell the most captivating story\, yet there was a certain appeal.  The game’s world is something truly special containing a surprisingly strong lead character and drop dead gorgeous visuals.  Despite some small of The Order’s strengths this still may be one you can pass on.… Expand"
93686,Order1886,2019-01-02,8,"I actually really enjoyed this game\, and it's unfortunate that we didn't get a new franchise out of it.  I love the steampunk weaponry and the Victorian London setting and aesthetic.   There's plenty of good\, and some frustrations.  Nothing i'd say is strictly \""bad\"" - maybe the length\, it's far too short.While I prefer a first person perspective\, for the most part\, this game uses theI actually really enjoyed this game\, and it's unfortunate that we didn't get a new franchise out of it.  I love the steampunk weaponry and the Victorian London setting and aesthetic.   There's plenty of good\, and some frustrations.  Nothing i'd say is strictly \""bad\"" - maybe the length\, it's far too short.While I prefer a first person perspective\, for the most part\, this game uses the third person very well.  I never feel like it's a hinderance to my view or anything.  The graphics are excellent - I'm not one to base much on visuals\, but this game is impressive.  The firefights are mostly excellent.  What I really love is that this isn't one of those annoying games where enemies take unrealistic damage.  Headshots take guys out immediately\, which is satisfying.  The various weapons are fun.Are you a fan of \""quick time events\""?  I'm on the fence: I don't think they're evil but I recognize that they also sacrifice control in the name of a more cinematic experience.  The QTEs can pop up with no notice and it's very easy to miss your marks.  But then it's also very quick to restart the game if you mess up.The Order is NOT an interactive tour de force:  stuff looks great\, but you can interact with precious little in the environment.  Search a room\, and find the few hotspots scattered around.  Again\, I'm not sure where I land on this.  On the one hand it's almost refreshing to have a game where you can't grab every minor object in sight.  Of course the game is very linear because of this - you're not really choosing your path\, you're following the only path available\, and there's a minimum of other stuff to get you sidetracked.Still - if you buy this game for a good price then I feel it's very much worth it.  I had fun\, and I find the combat fun enough that I'm replaying it.  There's a lot that could've been done better in this game - or\, let me rephrase that - perhaps more could've been done to open up the world for exploration?  I don't know.  Every game is a sandbox these days.  Having a game that just pushes you through the story isn't necessarily bad.As you can see\, even in my \""enthusiasm\"" for this game I'm kind of  wishy-washy.  I like The Order: 1886.  It is a fun\, solid premise for a franchise that never got off the ground.  Perhaps it's a bit old fashioned\, not being an open world sandbox.  Many games only give you the impression of freedom\, and maybe that's one of the problems - The Order tells you where to go and what to do next - there's not much else you can do other than move on to the next plot point.While enjoyable\, this game was a missed opportunity. It could've been so much more\, and it's a shame that this didn't get off the ground as a franchise.  I can totally see why gamers didn't flock to a 5-7 hour\, cutscene-heavy adventure.  But there is a certain charm here\, if you're willing to look past some of the shortcomings.… Expand"
93687,Order1886,2015-02-23,8,"This game doesn't deserve to be below the score of 70. The game was great from start to the end and even thought a few elements could be better\, such as longer gameplay. i still enjoyed the story and it had a solid mechanics. The graphics are unbelievable and i don't doubt the sequal will be RAD's biggest masterpiece. This game is worth playing for sure.It's not amazing but it's great."
93688,Order1886,2015-03-01,5,"I wanted to enjoy this game. A lot. It was a promising blend of high technology and the supernatural\, and it was gorgeous.I have no problem with lengthy cutscenes\, or QTEs used well and appropriately. Or games that are not heavy on action and focus more on story.\n\nWhat disappointed me was the wasted potential of The Order. It was a new world with a fresh set up (modern day ArthurianI wanted to enjoy this game. A lot. It was a promising blend of high technology and the supernatural\, and it was gorgeous.I have no problem with lengthy cutscenes\, or QTEs used well and appropriately. Or games that are not heavy on action and focus more on story.What disappointed me was the wasted potential of The Order. It was a new world with a fresh set up (modern day Arthurian knights with an arsenal supplied by Tesla) but it wound up having little soul. It reminded me of the stereotypical supermodel: all looks but nothing behind the ears. The much maligned full frontal male nudity scene summed it up for me: why create an engaging world to go with a fresh idea when one can use parlour tricks to hopefully engage the audience and sell game discs.This game does have positives\, but it seems more like a proof of concept than a compelling experience. And it is a bloody shame.… Expand"
93689,Order1886,2015-03-12,7,"7/10 Simply because the game is beautiful. Not worth the full price tag though due to the lack of freedom and stuff. Although it plays similar to the GoW Franchise its nowhere near as fun.Also I understand the game isn't a sandbox game where you can do numerous things but in today's technology and next generation gaming\, you expect a slight bit of freedom."
93691,Order1886,2015-03-11,7,"I found the order to be a good but not brilliant game\, their has been some complaints about the shortness of the game this did not overly bother me but the game could do with some extra content to provide more value for gamers. The graphics are brilliant perhaps the best so far on PS 4 it is obvious that the developers have aimed for a cinematic experience. The gameplay was enjoyable butI found the order to be a good but not brilliant game\, their has been some complaints about the shortness of the game this did not overly bother me but the game could do with some extra content to provide more value for gamers. The graphics are brilliant perhaps the best so far on PS 4 it is obvious that the developers have aimed for a cinematic experience. The gameplay was enjoyable but not spectacular the cover shooting can get tedious especially on the second play through of the game.Overall Score 7Graphics 10Gameplay 7Longevity 4… Expand"
93692,Order1886,2015-03-14,7,It depends on whether you like cinematic action third-person shooters.Beautiful visuals.  Good action and great moments.  Cinematic cut scenes are a bit long and sometimes uninvolved.Not an open ended game and not meant to be one.Worth the buy.
93693,Order1886,2015-03-14,8,"This is by far the most beautiful game I've ever played. The graphics are great\, yes\, but the eye for detail in this game is excellent. From start to finish\, I did not encounter any bugs. I did encounter many breathtaking moments. The characters\, the style\, the city\, the clothing\, the design of this game is so well done. This game is a technological masterpiece.Then the rest of theThis is by far the most beautiful game I've ever played. The graphics are great\, yes\, but the eye for detail in this game is excellent. From start to finish\, I did not encounter any bugs. I did encounter many breathtaking moments. The characters\, the style\, the city\, the clothing\, the design of this game is so well done. This game is a technological masterpiece.Then the rest of the game. The story? It's good. It's fun. The acting is pretty good and it's an interesting world to dive in to.The gameplay? I didn't found it bad in any way\, but I can understand it isn't the most innovative game ever.But you know\, that doesn't matter that much. For me\, The Order: 1886 is about the complete package. The experience of playing it from start to finish are\, for me\, 7-8 hours extremely well spend. I've enjoyed every minute of it and although I thought I would sell this game after finishing it\, I've decided to keep it. This game is a masterpiece and an excellent presentation of what gaming can and will become.Gameplay wise it may lack\, it isn't as rich in features as games can be\, especially if you compare it with the likes of GTA or something. But that doesn't matter at all.I'm looking forward to the future of gaming based on titles like this. If you can have the beauty\, detail and quality of a game like this\, and combine that with the excellent gameplay of a game like Red Dead Redemption\, then I'm pretty damn sure I will never quit gaming until the day I die :-).… Expand"
93694,Order1886,2015-03-28,7,Best next gen game graphics - sounds and nice story but the gameplay isn't good the weapons are great and great cutcenes but it's looooooooooooooong and the gameplay are short.If you have ps4 wait for sell and buy this game it's Not worth 60$. But it good game.
93695,Order1886,2015-03-24,8,Despite the game length this game is a gem. The story is very engaging and while there is a lot of cutscenes it really immerses you in the Order 1886 world. The voice acting is top notch really makes you feel like you are in the world. The interactions and dialogue are perfect and was surprised for a brand new IP. The guns are really satisfying to use especially the special weapons. TheDespite the game length this game is a gem. The story is very engaging and while there is a lot of cutscenes it really immerses you in the Order 1886 world. The voice acting is top notch really makes you feel like you are in the world. The interactions and dialogue are perfect and was surprised for a brand new IP. The guns are really satisfying to use especially the special weapons. The difficulty isn't too hard and some of the enemy AI can be cheap (Shotgunners) that doesn't stop the fun of the game.QTEs aren't plentiful in the game. They are placed throughout the game and wasn't bothered by it. The Lycan combat was very dissapointing and so were the Boss battles. Some of the story was questionable near the end however the graphics are out of the World and worth the purchase.… Expand
93696,Order1886,2015-03-25,7,everything about this game works and is great. The only reason i'm giving it such a low score because of the SHORT story. definitely worth a shot if you want something quick to play through
93697,Order1886,2015-03-27,8,"It was a fun little game while it lasted. It is definitely more along the line of cinematic experience\,but the gun play is strong and the story is decent.Its length is definitely a flaw and some people may not like the way the game is presented\,"
93698,Order1886,2015-04-23,5,"This game has been getting a hell tone of mixed reviews but this is my opinion. It looks god damn amazing but sadly their is no reply value\, poor ai\, to many QTE and over a bad experience"
93699,Order1886,2015-08-14,10,"Meu Pau de Oculos que esse jogo tem a nota 6.7\, povo babaca que nem joga o jogo e quer ficar dando nota\, 4 È AS MINHAS BOLAS DE PIERCING\, filhos da puta\, o jogo começa lento claro\, concordo que nao gostei mais a partir dos primeiros 30 minutos o jogo fica bom demais amei o jogo\, e por Gente BABACA que nem vcs nao vai ter continuçao."
93700,Order1886,2016-07-31,10,"I thought this was a very well done game\, and seeing as the reviews are very mediocre here\, I'm reminded that I cannot trust the reviews to find great titles. Beautiful graphics\, neat story\, great voice acting\, intense gun fights. The only drawback is that it is fairly short. But if you get it discounted like i did\, completely worth the buy."
93711,Order1886,2017-01-04,8,Deutsche Review - KritikDer folgende Test ist in 5 Kategorien zusammengefasst. Diese 5 Kartegorien ergeben die Gesamtpunktzahl von 0 - 100 Punkten. Um einen passenden Userscore zu geben wird auf oder abgerundet. Bei 84 Punkten ergibt das einen User Score von 8. Bei 86 einen von Userscore von 9. Falls eine 85 kommt entscheide ich ob ich es eher positiv oder negativ nehme. RegelnDeutsche Review - KritikDer folgende Test ist in 5 Kategorien zusammengefasst. Diese 5 Kartegorien ergeben die Gesamtpunktzahl von 0 - 100 Punkten. Um einen passenden Userscore zu geben wird auf oder abgerundet. Bei 84 Punkten ergibt das einen User Score von 8. Bei 86 einen von Userscore von 9. Falls eine 85 kommt entscheide ich ob ich es eher positiv oder negativ nehme. Regeln verstanden?Dann sind hier meine Punkte.Mein persönlicher Score = 77/100Mein User Score = 8/10… Expand
93701,Order1886,2015-07-20,9,"Ah\, the common whiny-horde of fanboys and critics who didn't bother to take the genre system into consideration.The maw of mediocrity and idiocy from the general lobby here is ... not refreshing and typically comical. The same old story\, in fact.The Order: 1886 was always meant to be a cinematic experience and shouldn't be judged beyond this scope. It is like forcing the merits of aAh\, the common whiny-horde of fanboys and critics who didn't bother to take the genre system into consideration.The maw of mediocrity and idiocy from the general lobby here is ... not refreshing and typically comical. The same old story\, in fact.The Order: 1886 was always meant to be a cinematic experience and shouldn't be judged beyond this scope. It is like forcing the merits of a JRPG upon the tightly knit confines of a Survival Horror genre and then expecting the contents not to blow up in ones face; hilarious\, isn't it? Expecting freshness from this one game and giving undue leeway to others is the age old desecration and rape of objectivity; why do people even pretend to hold third person view points? It's just unfathomable.As I mentioned\, The Order shouldn't be judged as anything beyond a cinematic experience. And there it truly delivers. It was always meant to be linear in its core; all structured and closely knit narratives always are linear. But hey\, who cares about that\, right? Whatevs\, the cool critics say from their snug corners\, their stink covering the underside of their lumpy hindquarters\, their blogger chairs raised high and their mighty fingers moving with the speed of an apt geek warrior ... their perches are quite high and mighty despite the stink that reeks of ignorance. How can us lowly folk even matter?Anything below a 6 shouldn't even be taken seriously\, as this game is a masterpiece on what was promised. Ah\, the forgetfulness of a common man is very hilarious to watch. Perhaps\, the audience - and these high-end critics alike - expected an open-world\, vast experience spanning across miles in the digital world with several branching points for the story and a new revolution in TPS genre history. Who are we kidding? Of course the developers promised all that and failed us all deliberately. The bastards.Sorry\, but I can't take most kiddy-people here seriously. Any score below the 7 mark is laughable. I can even fathom and understand the 6 marks\, as a lot of people fuss over lengths\, but any review that takes out a single point from that is really pushing it. For me\, the game delivered what it promised; a cinematic experience. May be\, people should take off those pasted-on\, self-serving blinders and see this venture realistically as a good play on digital narrative\, as this was not anything but.… Expand"
