94525,UD,2018-09-04,10,"Of recent I have enjoyed Life is Strange and Everybody's Gone to the Rapture - two games of which use an extensive narrative viewpoint in their own unique ways\, coupled with varied elements of gameplay to stunning effect. It has been up to this point that I have wondered how would it turn out if such stunning effect were applied to a game in the horror genre… Expand",true
94529,UD,2016-03-24,8,"[Brief Synopsis of Full Review]So\, despite the small flaws and cracks in its casing\, Until Dawn is an entirely competent and enjoyable horror adventure and certainly a commendable effort on the part of the developers. It is well-worth the anticipation and wait\, as well as all the trouble it went through in production. It's discordant and lacks true focus in certain instances\, but it never loses track of what it is or where it's going\, making it a creepily tantalizing game and story.Concept: Revel in the atmospheric horrors of a classic slasher film from the comfort of your couch\, and better yet make the decisions leading to gruesome and sometimes hilarious and well-deserved deaths all the while progressing through an interesting and malleable plot.Graphics: The visuals\, the animations\, and the overall content showcase a fine level of quality and add believability to the resume as well. Yes\, I probably made that word up.Sound: Both the melodies and the voice work add to the already well designed experience and add a higher sense of tension appropriately where needed.Playability: While the majority of gameplay focuses on simplicity\, that's not to say it isn't still a highly enjoyable and interactive experience.Entertainment: I hope you like tripping and being cleaved in half by a tottering psychopath\, because that and even more is in store for you if you choose to play this game.Replay Value: Moderate.Overall Score: 8.0… Expand",true
94526,UD,2015-10-13,8,"Until Dawn plays like you'd expect from an interactive game that boast 'huge' decisions in it's story. It's stiff\, with a bunch of quick time events and mediocre characters. Somehow though\, Until Dawn gives just enough camp and an interesting enough plot that actually tailors to your choices to make it worth a playthrough or two. It's also one of the best looking games on the Playstation 4.",true
94538,UD,2015-09-30,8,"After some yelling at the screen\, a couple of jump scares and a dozen or so tense hours I made it to the end: 3 survivors. I would have like to have more but I can always go back and try again.Until Dawn doesn't offer you the most innovative or complex gaming mechanics but it makes up for it with a wonderful cast variety\, an intriguing story -of which you mostly control itsAfter some yelling at the screen\, a couple of jump scares and a dozen or so tense hours I made it to the end: 3 survivors. I would have like to have more but I can always go back and try again.Until Dawn doesn't offer you the most innovative or complex gaming mechanics but it makes up for it with a wonderful cast variety\, an intriguing story -of which you mostly control its development- and a creepy atmosphere. I'm still experimenting with it's \""butterfly effect\"" system and what I like about it is how you can go to it at any time to see what effect your actions and decisions have so far in the story. Game looks good and it feels right and definitely has some replay value.This genre lacks enough quality games and with UD you have something unique and surprisingly fun. I would recommend this so give it go.… Expand",true
94541,UD,2015-09-29,8,The list of PS4 exclusives is a growing list of some truly  excellent AAA titles.  Until Dawn sits perfectly in this growing list.The story isn't overly original but is well written and pacing is excellent.\n\nDidn't take  long to play through but thoroughly entertaining. With the choices system in this game effecting the outcome I'm already keen to get stuck in and play it again makesThe list of PS4 exclusives is a growing list of some truly  excellent AAA titles.  Until Dawn sits perfectly in this growing list.The story isn't overly original but is well written and pacing is excellent.Didn't take  long to play through but thoroughly entertaining. With the choices system in this game effecting the outcome I'm already keen to get stuck in and play it again makes different choices.… Expand,true
94539,UD,2015-11-10,7,Wasn't scary thats for sure but i like this kind games  you making choices and game depens what you choice characters and atmosphere is good woth buying.7/10,true
94545,UD,2016-01-18,9,"Great game\,nothing to say...u play and u will know...Much better if u use headset and max the volume and play at night and off ur lamp!!!Hahahahahaha...Try it dude!",true
94540,UD,2016-01-15,9,"[CONTAINS SPOILERS]When I saw that people were comparing Until Dawn with great games in the genre like Heavy Rain\, Beyond: Two Souls\, or even the more recent The Vanishing of Ethan Carter\, I thought to myself: \""Damn! I have to get that game!\"" But at the time I was aiming for the release of other titles that interested me more\, until this Christmas when I saw a good deal and I decided[CONTAINS SPOILERS]When I saw that people were comparing Until Dawn with great games in the genre like Heavy Rain\, Beyond: Two Souls\, or even the more recent The Vanishing of Ethan Carter\, I thought to myself: \""Damn! I have to get that game!\"" But at the time I was aiming for the release of other titles that interested me more\, until this Christmas when I saw a good deal and I decided to buy it.I'm not a huge fan of these games\, my girlfriend enjoys them much more than I do\, but it is certainly a great game\, I think it'll have a place at the horror games genre for a long time.The graphics are spectacular\, the characters facial expressions fascinate me\, the environment is also incredibly terrifying: A snow storm in a dark and spooky mountain in the middle of nowhere with all sorts of horrors: mutilated animals\, monsters\, murderers\, ghosts\, legends about supernatural things\, a really badass asylum\, abandoned mines ... And scares around every corner! I can still remember me and my girlfriend playing around 2AM when suddenly a freaking black wolf appears out of nowhere at the asylum\, God we shouted out loud... We looked at eachother and we started laughing and  looking everywhere for if there was a wolf in our living room\, hahahaha! Our neighbor didn't find it that funny and started banging on the wall! And playing Emily in the mines... Goodness gracious... Can't you already shut the hell up blody Wendigo? Hahahaha!!As for the story\, I love games where your actions affect the course of the game's story\, in Until Dawn they have captured that and have taken it to the extreme\, having the possibility to kill all characters for the slightest judgment or decision that doesn't even seem that important\, and just to remind you they tell you what you did wrong\, like: \""It's your fault he's dead!\"" :\,( They have done a great job and have taken care of every detail\, you discover the history of the mountain and all the horrific events that occurred there bit by bit.There was only one thing I don't really get to understand\, and it's Dr. Allan's role\, Joshes psychiatrist. At the beginning I can clearly see that all those questions he asks you about your biggest fears and all that stuff is what go seeing along the adventure\, but when you reach certain point in the story... Well\, it lost its meaning and his purpose is not very clear. Yes\, we get that he's an hallucination and that Josh is crazy\, so what?Nevertheless\, I've had a blast both times I played with my girlfriend and the next time I'll do a collect'em all trophies.Definitely a good title to enlarge my PS4 collection :) See ya!… Expand",true
94544,UD,2015-10-19,8,"Until Dawn puts you into the role of a classic\, cliché\, and predictable Friday the 13th like story. 8 teens\, alone in a lodge\, must face the horrors of an alleged killer\, monsters\, and even ghosts. All the typical horror movie types in one game. Monsters... ghosts... a killer? Well then. Needless to say\, this game takes real cheesy horror movie stereotypes\, and makes it a very tolerable\,Until Dawn puts you into the role of a classic\, cliché\, and predictable Friday the 13th like story. 8 teens\, alone in a lodge\, must face the horrors of an alleged killer\, monsters\, and even ghosts. All the typical horror movie types in one game. Monsters... ghosts... a killer? Well then. Needless to say\, this game takes real cheesy horror movie stereotypes\, and makes it a very tolerable\, and incredible game. Until Dawn is  best release in the horror game genre\, in a long time. Until Dawn makes you take many decisions throughout the gameplay experience with a system called \""Butterfly Effect\"". Once you make a decision\, it's set in stone. All of your decisions effect the gameplay\, and coming from an avid gamer like myself\, I love this feature more than anything. It makes you stop and think about the future consequences of each decision. Your choices impact the lives of all 8 teenagers\, and it's up to you to keep them alive 'Until Dawn'. Great game\, worth getting for sure.… Expand",true
94536,UD,2015-09-30,8,"I enjoy watching horror movies because they are always fun to watch especially after a hard day’s work and I always wanted a special horror game that combined all the best elements from horror movies. Thankfully\, Until Dawn succeeds in doing so.Eight friends gather together in a remote cabin on top of the mountains. Things start of well with each of the characters trying to have a goodI enjoy watching horror movies because they are always fun to watch especially after a hard day’s work and I always wanted a special horror game that combined all the best elements from horror movies. Thankfully\, Until Dawn succeeds in doing so.Eight friends gather together in a remote cabin on top of the mountains. Things start of well with each of the characters trying to have a good time; however\, little did they know that they are not alone; something or someone is watching their every move. Panic escalates when the group suspects that they are being hunted so they start helping each other to find out the mystery behind all of thisUntil Dawn is a survival horror game that focuses on quick time events\, each of the characters will face different situations throughout the game and you will have to control each of them by taking choices and tough decisions that will affect how the game plays out for each character’s.The choices and difficult decisions I had to make kept me at the edge of my seat because of how smartly they were done. I had to stop and think for a while on what choice is best.From the relationships between the characters to the shocking deaths\, everything you do means something. Would you take a short cut and avoid the risk of falling or would you play it safe and follow the footsteps? The choices are endless. I liked how the characters interacted with one another; each one has his or her own personality traits that helped in making them feel unique. My personal favorite was mike\, a funny and brave character.The controls are simple\, choosing your actions were straightforward and the sensitivity controls worked perfectly especially by adding tension in climax situations.Throughout the game\, you will collect totem prophecies which foretell a possible future event. How you play will determine whether or not the prophecies come true. Collecting clues is important as this will help in solving the mysteryThe details of the facial expressions are impressive and the overall eerie environments along with the good camera angels successfully give you a sense of lonelinessThe main campaign took me around 8 hours to complete but the replay value is high so you will find yourself going back and playing the game many times to try different things.I enjoyed the progression of the story. After a series of strange events the characters find out that a psychopath is after them and the suspense and tension rises. The psychopath reminded me of Michal Myers and Jason\, the way he walked and stalked you was scary.Until Dawn never felt boring I just wanted to keep on playing and find out what happens next.Until Dawn is like watching an awesome horror movie\, the creepy music and countless number of scares were awesome. The clever story is filled twists and turns and I never expected anything. This game is one of the biggest surprises this year. a truly engaging game and a great homage to horror mvoies.… Expand",true
94542,UD,2015-09-30,9,This game is really good. Im not the biggest fan of 'point and click adventures' but this takes the cake. It feels like you are controlling a horror story. Until Dawn is worth at least one play through if you are a horror junkie. I will probably play this game four to five times just to make sure i get everything I can out of it.,true
94546,UD,2016-06-01,8,"OK. Until Dawn\, is a good game. With some \""ifs\"" sprinkled in there. It's a good game if you like story\, (however disjointed at times it may feel)\, it's also a good game if you like beautiful graphics and pretty good mo-cap.It is not a good game if you value gameplay. This is an artistic piece through and through. I played it and don't regret it one bit. I won't however\, be playing itOK. Until Dawn\, is a good game. With some \""ifs\"" sprinkled in there. It's a good game if you like story\, (however disjointed at times it may feel)\, it's also a good game if you like beautiful graphics and pretty good mo-cap.It is not a good game if you value gameplay. This is an artistic piece through and through. I played it and don't regret it one bit. I won't however\, be playing it again.The game starts at a pretty decent pace and without spoilers\, will dig it's meaty claws into your shoulder and will not let go. It's full of horror tropes you've come to know and love\, (people going alone\, things that go bump etc...). For the most part you may not care about the characters as much as you led to believe by the butterfly effect system.  I saved 4 people on my playthrough\, but knew I was damning a few and didn't really care. I wanted to see it finished.The first half of the game is where it's strongest. You have no idea of what is going on and it makes for some tense creepy moments. It borrows heavily from various horror franchises\, but yet seems to be it's own. In between each episode you see a piece with Peter Stormare\, that is pretty well done. It's beautiful and it works well.The failing begins during the second half of the game. At this point\, the plot\, (again without spoilers)\, takes a heavy turn and it's not for the best. Imagine watching a slasher flick that suddenly becomes a supernatural romp and you get the idea. It almost felt as if the writers had painted themselves into a literary corner and now were looking for an out.For those who say all it is\, is QTE; it isn't. But it does rely heavily on the QTE button presses for some of it's scenes. The problem here is that failing some of these QTE doesn't always end badly. For a game that has no compunction with death\, it seems a little out of place. Sometimes the failing of the QTE can actually be helpful.The sound design in this game is a definite strength. For jump scares\, use headphones. You won't regret this part at all.  The character designs are well done and the Mo-cap is really well implemented...to a point.Some of the animations when the characters are talking seem really wire-framed and limited in motion.  There is little in the way of true gameplay here. You walk\, you look at shiny objects\, you pick things up and you QTE certain areas. That's about the gist of it.One major gripe is how the camera can shift when you are walking in one direction. Effectively this can change the direction you need to press to be able to continue in the same direction. It's reminiscent of Resident Evil in that way.There are multiple endings in the game\, which can be altered via the butterfly effect. Admittedly I only played through once\, but I have no desire to go through the game again. Yet somehow\, I doubt the game itself up until the end point changes very much\, which is a shame. It would be nice to see that if Character A dies and I let Character B live that the game is very altered. All in all though the butterfly effect just doesn't seem to have wings. It's just a caterpillar still on the ground.So if you are looking for a game heavy with story\, this may be for you.You want a roughly 7-9 hour long interactive movie\, pick it up\, but I'd wait until it is down to the $20 mark if I were to be honest. I paid $40 and it still felt like too much.I gave it an 8\, because for what it is and what it tried to do\, I thought 7 was too low. If I could even though some people don't like half marks\, I would give this game a 7.5… Expand",true
94543,UD,2015-10-01,8,"Until Dawn may not be the perfect game but I was entertained during the experience along with great graphics and a slightly compelling story. I say slightly because the entire story didn't have my full attention and some characters became overrated or overused. But none the less\, Until Dawn was a great game and very enjoyable.",true
94553,UD,2017-09-19,9,"Surely a must buy for PS4 owners. The atmosphere\, story telling\, characters\, and choices are all great\, and forces you to play through the game again to try out other choices. Choices are brilliantly designed to have a lot of impact\, even going certain paces make a huge difference.",true
94556,UD,2019-04-26,9,"Tuve miedo\, literal\, de adquirir este videojuegoNo soy un fanático del género del terror (Resident Evil excluido de esto)\, ya que considero que las tramas y desarrollos de personaje en este género son dejados de lado para solo impactar en imágenes al consumidor\, ejemplo de esos hay muchos.Si bien al inicio la trama puede ser una típica película de terror de los 90\, el tiempo que te danTuve miedo\, literal\, de adquirir este videojuegoNo soy un fanático del género del terror (Resident Evil excluido de esto)\, ya que considero que las tramas y desarrollos de personaje en este género son dejados de lado para solo impactar en imágenes al consumidor\, ejemplo de esos hay muchos.Si bien al inicio la trama puede ser una típica película de terror de los 90\, el tiempo que te dan al inicio te ayuda a identificarte con los personajes ya sea desarrollando empatía u odio por cada uno de los personajes.Lo positivo es que las decisiones sí tienen impacto en la trama\, así que tratar de dar una reseña de la trama sería algo complicado ya que no siempre vas a desarrollar las mismas decisiones que otros.Advertencia: Los totems pueden spoilearte lo que va a pasar\, pero puede influir en tus decisiones… Expand",true
94550,UD,2016-08-07,10,"Masterpiece. 10/10 Great tribute to the films of the 80's. It's more than a game\, it's a fabulous experience. We need more games like this.Awesome game\, Supermassive Games!",true
94552,UD,2017-03-12,8,"A great storytelling game. Thats why PS4 is a great console this generation. I play this game about 4-5 times.After that you basically finished with the game. But i got my money worth.I dont recomended it for 60$ \, But i think now the price is about 10-15$.Go get it you will not be disappointed if you are the fans of game like this.",true
94554,UD,2018-09-24,10,At first I thought that it was a banal horror film on vacation. But there were unexpected turns. Very cool!,true
94559,UD,2015-09-07,7,"I really enjoyed Until Dawn.Although any story twists and shocks barely raised an eyebrow on this horror veteran.As an interactive movie\,it's a great success\,but as a video game it is less successful.It really needed more meaningful interaction besides QTE and conversation choices.Sadly\,all of the characters were dull and predictable\,though it was hard to dislike Sam and Emily wasI really enjoyed Until Dawn.Although any story twists and shocks barely raised an eyebrow on this horror veteran.As an interactive movie\,it's a great success\,but as a video game it is less successful.It really needed more meaningful interaction besides QTE and conversation choices.Sadly\,all of the characters were dull and predictable\,though it was hard to dislike Sam and Emily was obviously designed to be despised by every player( Just die you b**ch) .Still\,it deserves a better sequel with better writing that doesn't treat it's audience like foolish horror amateurs...… Expand",true
94558,UD,2020-06-24,8,Love this game but characters were difficult to move at times otherwise it is a great game,true
94557,UD,2019-11-03,10,"Классная игра! Это первая моя игра в жанре Интерактивного кино\, и эта игра смогла меня зацепить. Всем советую к покупке!",true
94551,UD,2016-12-13,6,"Story - The story centers around 8 friends in their return to Blackwood mountains after one year from the day of accident that occured to the sisters of Josh (One of the main characters in game) and the horrors and secrets they will all uncover and experience and must survive until dawn.The game is based on the classic B rated Slash/horror films that was really popular on the 90s and itStory - The story centers around 8 friends in their return to Blackwood mountains after one year from the day of accident that occured to the sisters of Josh (One of the main characters in game) and the horrors and secrets they will all uncover and experience and must survive until dawn.The game is based on the classic B rated Slash/horror films that was really popular on the 90s and it pays homage to its story cliches. Therefore\, you can both say it is a lazy effort by the developers or that they are just loyal and gave good research to those classic horror genre in its golden era. due to this\, it will be very common for you to feel frustrated to the usual stupid decisions teenagers make in this game. However\, what really interests me is that you as a player can decide for them in certain aspect of the game\, and by doing so. You may or may not help them survive until the end. It will not change the general story however\, it will give you more interactions since more characters will be alive by then. However\, my main problem is that for a horror game\, it never was scary for me at all. Yes there are a few jumpscares here and there and creepy places. But after finishing the game i never felt any reluctance to play it again like what games like alien isolation gave to me\, i couldnt feel any more of this scary moments or pressuring moments. With these\, a fair score of 6/10 will do.Gameplay - Gameplay also returned to the days where Resident evil and Silent hills dominates the horror genre with its fixed camera in your exploration. As to the interactivity of the game\, i can say that it is good despite its lack of quantity esp. those scenes where you should not move since most of them will usually result in your character being put in a bad spot or may jump to their deaths. Another to thing to add that the whole campaign is short but since it is a story driven which changes based on your choices\, it has a great level of replayability. You can decide to kill them or try to challenge yourself to make them all survive. With this regard\, a good score of 8/10 deserves this aspect of the game.Graphics - As to the environment\, it is almost perfect. The places are haunting\, creepy and will really give you the goosebumps in your exploration. As to the character design\, i liked how the developers really put effort in the motion captures of its characters. Their facial expression are realistic and detailed. However\, my main problem is the FPS drops that comes more often than not in its cutscenes and due to this\, delay of sounds or voice sounds occurs which gives me major problems since it is a game where you spend most of the time watching than playing it. Therefore\, a score of 7/10 deserves such plus and minus.Music and Sound - The music of this game overall is good. The timed sections has that loud music which puts more pressures to you and the haunting ones are properly inserted in those creepy areas which adds to its uneasiness. As to the sound\, Id say it has its ups and downs\, as to the ups\, voice acting of the characters is good and also the sudden sounds that comes in within jumpscare moments are spot on. In fact\, i had more jumpscares from the sound rather than from the game's visuals. The downs is the same with the cutscenes that sudden framedrops occurs which makes the sound delay and not following the mouth movements of the characters. Considering all the factors i have said. it deserves a score of 7/10.Average score = 6.75 (I dont round off my scores since i dont give perfect scores and zeroes i.e. 9.6 rounded off to 10)Supermassive games really showed that they have potential to make story driven interactive games. It needs some improvements like its story and also that bad fps and needs more scary moments\, but overall\, i was satisfied with the game. I hope they would continue to improve in this aspect and release games in the future that would be in the level of quantic dream games. awesome and hope they live until dawn\, lol.bad joke i know just kidding.… Expand",true
