94368,UD,2015-12-07,8,"Until Dawn is an excellent game and well worth checking out. The graphics are superb. Atmosphere and environments on point\, and has compelling acting. It plays as a sort of movie game so in terms of \""gameplay\"" doesnt require much other than some quick time events. Most of what you will be doing is making decisions which will affect the story\, and who survives.Keeping in mind that theUntil Dawn is an excellent game and well worth checking out. The graphics are superb. Atmosphere and environments on point\, and has compelling acting. It plays as a sort of movie game so in terms of \""gameplay\"" doesnt require much other than some quick time events. Most of what you will be doing is making decisions which will affect the story\, and who survives.Keeping in mind that the game story is set as a typical teen horror movie will help you to oversee some of the silly things characters do (calling your friends name while in a dark and suspicious room). Its cliche like that but it knows it and doesnt try to be something else. As far as a horror story\, it flowed seamlesly and didnt jump at irregular intervals as the story developed\, which can be the case for alot of horror type games/movies.Overall\, it was one of those games that kept me wanting to play. Any game that does that is a success in my books. Its obvious that a lot of effort went into this game\, the attention to details in some spots is just applaudable.I give it an 8 because of some stiff movement\, a few holes in the story (bound to happen anyway)\, and there can be some room for improvement in terms of character development.… Expand",true
94520,UD,2015-10-30,9,I was very skeptical getting a horror game but I was not disappointed at all. The game uses very old school jumpscares but it delivered. Very clever camera work and slowly building a relationship between you and the characters. I must admit I wanted them all dead in the beginning but as you play you end up wanting to save every single one of them. I was thoroughly entertained and the onlyI was very skeptical getting a horror game but I was not disappointed at all. The game uses very old school jumpscares but it delivered. Very clever camera work and slowly building a relationship between you and the characters. I must admit I wanted them all dead in the beginning but as you play you end up wanting to save every single one of them. I was thoroughly entertained and the only down point I would say is if you were to replay an episode you have to play through to the end again...which is a bit annoying as you could mess up again.… Expand,true
94183,UD,2015-09-04,10,"This game came out of nowhere. I love it! The graphics are amazing - excellent motion capture work. It has one of the best horror narratives I've seen in years.I'm lucky\, my girlfriend likes relaxing with me and playing video games (Bloodborne was intense for the entire household ah ha). But if you're trying to spend a few good nights together\, I'm sure anyone will be addicted to thisThis game came out of nowhere. I love it! The graphics are amazing - excellent motion capture work. It has one of the best horror narratives I've seen in years.I'm lucky\, my girlfriend likes relaxing with me and playing video games (Bloodborne was intense for the entire household ah ha). But if you're trying to spend a few good nights together\, I'm sure anyone will be addicted to this game until it's finished (UNTIL DAWN). Not much gameplay here either so I had her steer about half of the game :)10/10 recommend.… Expand",true
94237,UD,2017-03-10,10,"If I could give this game more than a 10\, I would. It is fun\, scary\, and there are so many different paths to take and different stories to see. There are what feels like an unlimited amount of endings. I\, personally\, have played through several times and have enjoyed it each time as much as the first. The graphics are top notch\, and the gameplay is easy enough for gameplayers of any skillIf I could give this game more than a 10\, I would. It is fun\, scary\, and there are so many different paths to take and different stories to see. There are what feels like an unlimited amount of endings. I\, personally\, have played through several times and have enjoyed it each time as much as the first. The graphics are top notch\, and the gameplay is easy enough for gameplayers of any skill level to have a good time. Every choice you make determines a future action. Make friends\, make enemies\, purposely kill everyone\, it's worth it.… Expand",true
94245,UD,2018-01-10,5,"I just bought my youngest daughter a  PS4 for Christmas and decided to pick up a couple of exclusive titles that I always wanted to play but couldn't.  Until Dawn was one of them.  I love choice/consequence type games and I kept hearing how good this was.  After an hour into the game I was seriously thinking of just removing the game from the PS4 and pretending I never saw it.II just bought my youngest daughter a  PS4 for Christmas and decided to pick up a couple of exclusive titles that I always wanted to play but couldn't.  Until Dawn was one of them.  I love choice/consequence type games and I kept hearing how good this was.  After an hour into the game I was seriously thinking of just removing the game from the PS4 and pretending I never saw it.I expected a good story\, really good voice acting considering who the VA's were\, but all I got was an inconsistent story and voice acting that was cringe worthy at times and ok at others.  It reminded me of  B horror movie and l love a good horror movie\, but this was your typical B movie where everything is predictable.  There were no scary moments\, the story was all over the place with no real pacing and the controls/camera angles were often frustratingly bad.  That could be from my inexperience with controllers\, but I haven't had that problem in other console games.In all I was really disappointed by the game.  Having played The Last of Us and Beyond Two souls just before Until Dawn\, maybe I set my expectations a bit to high.… Expand",true
94372,UD,2015-08-30,10,"To sum this game up: WOW!If you like Teen slasher/horror movies and games like Heavy Rain i highly recommend this game to you.\n\nIts beatiful\, scary and funny. You choices actually matter.\n\nThe game takes about 8-10 hours your first playthrough. But it has alot of replayability since you choice matters => You decide who live who dies.\n\nAlot of people dont understand why you haveTo sum this game up: WOW!If you like Teen slasher/horror movies and games like Heavy Rain i highly recommend this game to you.Its beatiful\, scary and funny. You choices actually matter.The game takes about 8-10 hours your first playthrough. But it has alot of replayability since you choice matters => You decide who live who dies.Alot of people dont understand why you have the scenes with Dr Hill inbetween chapters but if you collect all collectables it will become clearer.I have never enjoyed a game this must on my second playthrough\, thats says alot.My first 10/10 for current gen consoles.… Expand",true
94249,UD,2019-05-13,10,"I will never forget this frightening adventure.I played through this masterpiece like 10 times in short period of time.I always wanted to know what will happen if i'd go a different path.The graphics look superb and the place is very memorable.I also loved almost all of the characters but i suppose everyone can find their favourite one\, mine was Emily.The story was great and kept lot ofI will never forget this frightening adventure.I played through this masterpiece like 10 times in short period of time.I always wanted to know what will happen if i'd go a different path.The graphics look superb and the place is very memorable.I also loved almost all of the characters but i suppose everyone can find their favourite one\, mine was Emily.The story was great and kept lot of surprises till the end\, i always wanted to know what is coming up next.The voice acting was amazing too and the music was nice.… Expand",true
94251,UD,2019-10-18,10,I give this 10/10 why I will explain this game got tire frequency and tire game option you gotta choose and everyone gotta scattered around to find out the missing sister and check clues if they alive and when the whole find out that they going against the evil spirit they think of the way to escape this place and if you wanna make them escape free a lot of them take a challenge byI give this 10/10 why I will explain this game got tire frequency and tire game option you gotta choose and everyone gotta scattered around to find out the missing sister and check clues if they alive and when the whole find out that they going against the evil spirit they think of the way to escape this place and if you wanna make them escape free a lot of them take a challenge by yourself your the 1 is controlling the game mechanics and pick a side carefully really carefully when you choose they is a option where you get lucky and where things turn wrong right this my opinion and the game that make a right good ways to us scared more and make us panic its just like other movies we watching and everyone get scared of **** but I give 1/10 and I hope the dev create another until dawn game in the another year… Expand,true
94254,UD,2019-07-01,8,"For anyone who may not know this is a decision based interactive game which also has some gameplay which is mostly quick time events and also a little bit of aiming/firing. I would recommend this as a must play or must buy for anyone with a ps4 for many reasons. The first is the quality of the title. I found the story and design interesting throughout which motivated me to continue. At noFor anyone who may not know this is a decision based interactive game which also has some gameplay which is mostly quick time events and also a little bit of aiming/firing. I would recommend this as a must play or must buy for anyone with a ps4 for many reasons. The first is the quality of the title. I found the story and design interesting throughout which motivated me to continue. At no point was I bored and I credit this to the breakaway rotation of the characters you play. Essentially play until a mistake or the chapter ends. In the case of a gameplay mistake the game just cuts away to another character and you play that character for a while. I really enjoyed how this not only limited boredom and frustration but also boosted interest in what the consequences of the mistake was going to be. Secondly the gameplay is for anyone. Kids to seniors honestly could play this. It's scary but not too scary\, gameplay is hard enough without being too hard nor is it too easy to be insulting. A nice mix was achieved and I presume the reaction times for this determination were determined during a tutorial test. Third\, the game is inexpensive considering its quality and gameplay duration especially since you can replay chapters after the game is over or just start a new game from the beginning. The most important reason though to try this game is that I just can't see many interactive games being developed with such love. In the bonus footage one actor suggests interactive games will be the wave of the future. I strongly disagree. In my opinion only several ideas will make strong decision based games and horror is probably the number one formula for it to succeed in. If true the games have a limited source to tap. Thinking about that the game are cliche\, will unlikely go blockbuster and from there the industry will likely shy away from making these games with a lot of resources. Luckily I feel this is the game that went all in and crafted a unique game to showcase the genre. In turn I feel this will be the epic peak of this genre as I just can't see many interactive games being better made than this. I just can't see how one can improve upon this game other than directly tying it to a sequel or more. But for what it is this is a very highly rated game for your first experience of this type of game and I give thumbs up for every aspect of its development. Very cheap entertainment imo.… Expand",true
94120,UD,2019-02-18,8,"Si te encantan las aventuras gráficas o las historias de terror\, este es tu juego. Until Dawn es uno de esos exclusivos que solo suman al catálogo de una consola\, aportando una riqueza y variedad acordes a la divertidísima aventura que ofrecen. En la piel de 8 amigos\, tendremos que volver un año después al lugar donde sus vidas cambiaron para siempre\, momento en el que da inicio una obraSi te encantan las aventuras gráficas o las historias de terror\, este es tu juego. Until Dawn es uno de esos exclusivos que solo suman al catálogo de una consola\, aportando una riqueza y variedad acordes a la divertidísima aventura que ofrecen. En la piel de 8 amigos\, tendremos que volver un año después al lugar donde sus vidas cambiaron para siempre\, momento en el que da inicio una obra que te mantendrá pegado a la televisión durante horas. Además\, ofrece uno de los planteamientos más interesantes del género: en base a tus decisiones\, puedes llegar a terminar el juego sin supervivientes. Sin duda\, uno de los imprescindibles de PlayStation 4.… Expand",true
94118,UD,2017-09-11,8,"We all know the slasher genre. Stupid teenagers and a maniac who will kill them with extreme brutality. I think we all wanted to be in these films. how to participate in them. And finally\, it happened!In UNTIL DAWN we manage each of the eight friends. We can skillfully escape from the dangerous situation\, and especially to kill some disliked the hero. And it's cool! Each of the eightWe all know the slasher genre. Stupid teenagers and a maniac who will kill them with extreme brutality. I think we all wanted to be in these films. how to participate in them. And finally\, it happened!In UNTIL DAWN we manage each of the eight friends. We can skillfully escape from the dangerous situation\, and especially to kill some disliked the hero. And it's cool! Each of the eight friends could die. Or to stay alive. It all depends on you. Yes\, there are pseudo-elections\, but the Ira carefully conceals them\, making the game seem more variable. And believe me\, the replayability of the game high! Can pereproyti game 3 times\, if not more.Eight friends perfectly played by real actors. Also in the game there is a psychiatrist played by Peter Stormare. His facial expressions are interesting to watch\, but at the same time it looks so ugly that even more terrifying.The characters seem to be cardboard at first. But over time\, they disclosed. And\, for example\, nasty muscleman at the end can be a real hero. The plot is long swings\, but over time\, gaining momentum and doesn't let go. You wonder what will happen next. Besides the role played by \""the butterfly effect\"" that changes the story.UNTIL DAWN is interaktywna game. QTE but not as interesting and raznoobraznye like in Heavy Rain. The characters sometimes look scary and unnatural. Chuvstvuetsa a certain woodenness of the hero when they are run. not a small part of the game we walk\, and the walk down to locations can be a grind. The story itself is interesting\, but to learn lore\, which will help to fully understand the story you need to look for collectionne items - and that's bad storytelling.UNTIL DAWN is a great game incarnation of the horror film with teenagers. It has everything: a serial killer\, ghosts\, monsters. The plot is intriguing\, the characters are pleasing\, and acting. The game is not perfect\, but it should pass. And get ready to be scared\, because there's a lot of skimmer.… Expand",true
94255,UD,2018-06-25,6,"After a prank goes wrong\, and results in the death of twin sisters\, a group of teenagers return to the mountain on which the tragedy occurred one year later in order to remember their friends. Things soon take a turn for the worst however....It's difficult to play Until Dawn without making immediate comparisons to Quantic Dreams titles Heavy Rain and Beyond: Two Souls. Thankfully thisAfter a prank goes wrong\, and results in the death of twin sisters\, a group of teenagers return to the mountain on which the tragedy occurred one year later in order to remember their friends. Things soon take a turn for the worst however....It's difficult to play Until Dawn without making immediate comparisons to Quantic Dreams titles Heavy Rain and Beyond: Two Souls. Thankfully this effort from SuperMassive Games is more interesting than either of those titles but your opinion of the game will still hinge greatly on just how interactive you expect want your games to be. The story itself\, while a little out there\, is relatively entertaining and the excellent cast (that includes Hayden Panettiere and Rami Malek) make a good job with the script. As the player you can't change the overall direction this story takes but your decision and actions\, or lack thereof\, decide how the characters react to each other and ultimately who lives and dies.Unfortunately\, from a gameplay perspective\, Until Dawn is far less successful. A large portion of the game is made up of wandering around (you can't even run!!) until you see a highlighted object that you can interact with. Occasionally you'll have to react quickly to certain events but this is always handled by QTE sequences in which you again just press buttons as prompted. A bit of editing to allow the important decisions to be made more frequently certainly wouldn’t have gone amiss.These type of \""interactive movies\"" continue to show promise but is there any reason the gameplay can't be enjoyable as well?… Expand",true
94228,UD,2016-12-20,9,"I personally enjoyed the game\, it's a very interesting take on a \""Horror Genre\"" game.The entire premise of the game is that every decision you make will drastically effect the outcome of the future.  An example would be\, you start off in a room with 3 doors\, you select one go into a different room which also has 3 doors\, you select one\, and continue.  No how drastically different wouldI personally enjoyed the game\, it's a very interesting take on a \""Horror Genre\"" game.The entire premise of the game is that every decision you make will drastically effect the outcome of the future.  An example would be\, you start off in a room with 3 doors\, you select one go into a different room which also has 3 doors\, you select one\, and continue.  No how drastically different would the game had been if you had chosen a different door at the beginning? >Butterfly Effect< and no I'm not referring to the god awful movie.Story wise it's basically your \""Run of the mill\"" horror >Movie< that follows all the typical rules of the setting. Except you literally choose what happens by your choices.Game has some mystery\, alot of \""Quick action\"" responses.  All in all I like the game because it does something different\, and it actually has alot of replay value to see how drastically you can change the story.  9/10    (+1 for having Peter Stormare in the game\, he brought alot of life into it)… Expand",true
94258,UD,2015-11-01,7,"I rented this game and finished over the course of three days.  I'm not big on horror movies / games\, but I wanted something to play for Halloween and this fit the bill. I think its a solid rental choice but not worth 60 dollars.Game has incredible environments and fantastic character models. The character's faces are definitely uncanny valley stuff\, but from a distance I'd swear theyI rented this game and finished over the course of three days.  I'm not big on horror movies / games\, but I wanted something to play for Halloween and this fit the bill. I think its a solid rental choice but not worth 60 dollars.Game has incredible environments and fantastic character models. The character's faces are definitely uncanny valley stuff\, but from a distance I'd swear they were footage of real people\, just very well done.At the beginning I felt like I was piecing together a mystery\, and it my main drive to continue playing. That said\, as the game progressed and the story came together I just wanted it to pick up the pace and end.I still don't understand why these teens go on vacation to a lodge during a harsh Canadian winter and never turn on the heat or one single light\, except late in the game when they're told its a bad idea. They also wade through rivers up to their waists.There are times when the story just made no sense to me\, but I won't spoil anything. Characters make some insane choices that you have no control over. I mean\, if you were told to stay put for one more hour till its daylight\, would you choose to go out into the dark alone where people have died? I understand the game would be pretty boring if you just waited out the danger but at least give me a plausible motive for decisions like this\, and the classic \""let's split up\"" bit.The game has a stats in the form of characteristics as well as a relationship status bar. These playno role in anything\, so far as I can tell.I can't really provide much insight into just how important your choices are\, other than determining who lives and who dies\, as I have only done one play through. The game is roughly 10 hours long\, and I don't feel like doing another play through - the Red-box is still picking rummaging through my wallet.Once beaten\, the game does allow you to start at various chapters to try and alter the story.I don't know how much the endings vary; only two people survived in my play through.I know I've mostly went on about the issues I've had with the game but its well worth a rental if you're in the mood for Quick Time Event\, choose your own adventure horror.… Expand",true
94220,UD,2017-06-03,9,"Until Dawn is and interactive horror where you can control 8 different characters and choose their destiny (in this case\, who will die and who will survive \""UNTIL DAWN\""). Gameplay is very simple\, you go and interact with environment among you\, or there are QTE sequences\, and the interesting part is choosing between 2 or more options which will have some impact on the story. It´s similar toUntil Dawn is and interactive horror where you can control 8 different characters and choose their destiny (in this case\, who will die and who will survive \""UNTIL DAWN\""). Gameplay is very simple\, you go and interact with environment among you\, or there are QTE sequences\, and the interesting part is choosing between 2 or more options which will have some impact on the story. It´s similar to games like Heavy Rain... Yeah...gameplay is not much\, but it´s the story what makes this game GREAT. Unpredictable twists\,  and very good atmosphere from start to end. Characters are typical 'slasher' types\, but they are still amazing. Anyone who loves horror genre should play this game. I hope there will be a sequel. 9/10… Expand",true
94373,UD,2015-08-28,9,"If you like cheesy 80's horror/slasher flicks\, and 'choose your own adventure' stories/games\, this is for you.I am a huge horror fan\, especially 80's. My favorite aspect of this game is the sound and cinematography. When you're walking down a snowy path\, hearing footsteps in the snow\, wind\, trees\, animals\, and the camera changes to a view where someone on the hillside is watching yourIf you like cheesy 80's horror/slasher flicks\, and 'choose your own adventure' stories/games\, this is for you.I am a huge horror fan\, especially 80's. My favorite aspect of this game is the sound and cinematography. When you're walking down a snowy path\, hearing footsteps in the snow\, wind\, trees\, animals\, and the camera changes to a view where someone on the hillside is watching your movements\, and reacting by hiding\, and heavily breathing\, it really is an 80's horror film. Plenty of homage is paid to some classics as well. It's a \""choose your own adventure\"" cinematic masterpiece. Some people may be upset that it isn't a \""game\"" per se\, but there's plenty of mechanics and exploration that are not QTE related. Really the fun lies in deciding who you want your characters to be\, and playing them out as such.As I mentioned the sound earlier\, that's where the real jump scares come from\, and there's plenty. I really enjoyed the twists and scares\, and if you have an open mind\, you will too.I give it a 9 instead of a 10 because the movement can be slow sometimes (but not like Rapture)\, and you couldn't always make decisions that you feel your character would. There's usually only 2 choices\, and some events could really benefit from more.… Expand",true
